listName,ItemText,Question,Option1,Option2,Framing,conditions.thisRepN,conditions.thisTrialN,conditions.thisN,conditions.thisIndex,trials.thisRepN,trials.thisTrialN,trials.thisN,trials.thisIndex,thisRow.t,notes,trial.started,button.started,button_2.started,text.started,text_2.started,trial.stopped,button.numClicks,button.timesOn,button.timesOff,button_2.numClicks,button_2.timesOn,button_2.timesOff,participant,session,date,expName,psychopyVersion,frameRate,expStart,
framing1.xlsx,"A random sample of 100 lawyers and engineers is taken. The sample ends up
comprising 70 lawyers and 30 engineers. From this sample, one person is interviewed. He is a
30-year-old man of high ability and high motivation. He promises to be quite successful in his
field. He is well liked by colleagues.",Which profession do you think the man is?,ENGINEER,LAWYER,1,0,0,0,0,0,0,0,1,0.12513683293946087,,0.02707950002513826,0.12513683293946087,0.12513683293946087,0.12513683293946087,0.12513683293946087,8.46997662493959,1,[8.361121541936882],[8.361129874945618],0,,,415484,001,2023-10-15_19h49.32.747,Framing_HieuLe,2023.2.1,60.045349515145595,2023-10-15 19h49.38.438572 -0500,
framing1.xlsx,"You are deciding between buying two cars, Car A and Car B. On a car review
website, you find that the average of 1,000 ratings for Car A is a 4.95/5.0 and the average rating
for Car B is 3.70/5.0.",Which car would you decide to purchase?,CAR A,CAR B,1,0,0,0,0,0,1,1,2,8.512549832928926,,8.471135166939348,8.512549832928926,8.512549832928926,8.512549832928926,8.512549832928926,11.30315920803696,0,,,1,[2.80051850003656],[2.800523667014204],415484,001,2023-10-15_19h49.32.747,Framing_HieuLe,2023.2.1,60.045349515145595,2023-10-15 19h49.38.438572 -0500,
framing1.xlsx,"At a fundraiser, you are presented with two options for a raffle ticket. For Option A,
you are guaranteed to win a gift card to a random restaurant valued at $5. For Option B, you
have a 20% chance to win a gift card to a random restaurant valued at $25.",Which option would you select?,OPTION A,OPTION B,1,0,0,0,0,0,2,2,3,11.340252541936934,,11.303764416952617,11.340252541936934,11.340252541936934,11.340252541936934,11.340252541936934,12.519264957983978,1,[1.188833334017545],[1.188838459085673],0,,,415484,001,2023-10-15_19h49.32.747,Framing_HieuLe,2023.2.1,60.045349515145595,2023-10-15 19h49.38.438572 -0500,
framing1.xlsx,"Linda is 31 years old, single, outspoken, and very bright. She majored in
philosophy. As a student, she was deeply concerned with issues of discrimination and social
justice, and also participated in anti-nuclear demonstrations.",Which is more probable:,Linda is a bank teller.,"Linda is a bank teller who is also
involved in the feminist movement.",1,0,0,0,0,0,3,3,4,12.57014495797921,,12.51989879203029,12.57014495797921,12.57014495797921,12.57014495797921,12.57014495797921,13.819832375040278,0,,,1,[1.2594906670274213],[1.2594962089788169],415484,001,2023-10-15_19h49.32.747,Framing_HieuLe,2023.2.1,60.045349515145595,2023-10-15 19h49.38.438572 -0500,
,,,,,,,,,,,,,,13.851156999939121,,13.820463125011884,13.851156999939121,13.851156999939121,13.851156999939121,13.851156999939121,,,,,,,,,,,,,,,
